{
  "acceptance_version": "v006",
  "authorization": {
    "channel": "interactive_user_instruction",
    "statements": [
      "27 筆 stop_normal_rag=true，可以開放只是到時候在根據身份別確認可以檢索的內容，32筆A檢核通過"
    ],
    "statements_sha256": "fcdea9c4eedb88d1f24c394137f070455539ccdeb23831428bd923164c896925"
  },
  "bindings": {
    "candidate_checksums_sha256": "8dc7fc5268dc35df4b0cd9f8b8a380761ddfdf3a0e06360d2cc0ebe8977e55c3",
    "candidate_path": "data/rag-v3/candidates/v003",
    "prior_purpose_acceptance_path": "data/rag-v3/review/acceptance/v005/owner-purpose-classification-acceptance.json",
    "prior_purpose_acceptance_sha256": "a447aede1d6b871afd40294f5ab39b4ad81e4fa96b9a00a83b7897576af5cd24",
    "prior_runtime_policy_path": "data/rag-v3/governance/source-family-policy/runtime/candidates/v003/source-family-runtime-policy.json",
    "prior_runtime_policy_sha256": "99aa1dd6ccf90970c798664fedaff9ae3dd2f769437ebebc4a54c07478a1b5bd",
    "source_policy_path": "data/rag-v3/governance/source-family-policy/candidates/v002/source-family-policy-map.json",
    "source_policy_sha256": "580bb1ce69c10886e0aebbdbdf8192ac76421c8922bdc14e0ed85f37a0026071"
  },
  "conditional_stop_decision": {
    "affected_chunk_count": 27,
    "audience_review_pending_count": 27,
    "decisions": [
      {
        "audience_review_status": "needs_review",
        "chunk_id": "hpa_dementia_health_education_resource_manual_201610_rag_v3_v003_0020",
        "effective_risk_level": "medium",
        "observed_allowed_audiences": [
          "care_professional",
          "family_caregiver"
        ],
        "observed_allowed_purposes": [
          "general_information",
          "health_education",
          "resource_navigation",
          "source_lookup"
        ],
        "owner_disposition": "CONDITIONALLY_RELEASABLE_AFTER_AUDIENCE_REVIEW",
        "prior_chunk_id": "hpa_dementia_health_education_resource_manual_201610_rag_v2_v002_0020",
        "required_next_gate": "PER_CHUNK_AUDIENCE_AND_PURPOSE_VERIFICATION",
        "runtime_retrieval_active": false,
        "source_id": "hpa_dementia_health_education_resource_manual_201610",
        "stop_normal_rag_preserved": true,
        "text_sha256": "c81fd4d8828b406dc6a5f30359b0b32916f6d6a355df362314b5020e446e811d"
      },
      {
        "audience_review_status": "needs_review",
        "chunk_id": "hpa_dementia_health_education_resource_manual_201610_rag_v3_v003_0021",
        "effective_risk_level": "medium",
        "observed_allowed_audiences": [
          "care_professional",
          "family_caregiver"
        ],
        "observed_allowed_purposes": [
          "general_information",
          "health_education",
          "resource_navigation",
          "source_lookup"
        ],
        "owner_disposition": "CONDITIONALLY_RELEASABLE_AFTER_AUDIENCE_REVIEW",
        "prior_chunk_id": "hpa_dementia_health_education_resource_manual_201610_rag_v2_v002_0021",
        "required_next_gate": "PER_CHUNK_AUDIENCE_AND_PURPOSE_VERIFICATION",
        "runtime_retrieval_active": false,
        "source_id": "hpa_dementia_health_education_resource_manual_201610",
        "stop_normal_rag_preserved": true,
        "text_sha256": "2c1f6bdb1627959bfda2f3089a29225ab21104bb36c4e60cf06fb4157715abfb"
      },
      {
        "audience_review_status": "needs_review",
        "chunk_id": "hpa_dementia_health_education_resource_manual_201610_rag_v3_v003_0022",
        "effective_risk_level": "medium",
        "observed_allowed_audiences": [
          "care_professional",
          "family_caregiver"
        ],
        "observed_allowed_purposes": [
          "general_information",
          "health_education",
          "resource_navigation",
          "source_lookup"
        ],
        "owner_disposition": "CONDITIONALLY_RELEASABLE_AFTER_AUDIENCE_REVIEW",
        "prior_chunk_id": "hpa_dementia_health_education_resource_manual_201610_rag_v2_v002_0022",
        "required_next_gate": "PER_CHUNK_AUDIENCE_AND_PURPOSE_VERIFICATION",
        "runtime_retrieval_active": false,
        "source_id": "hpa_dementia_health_education_resource_manual_201610",
        "stop_normal_rag_preserved": true,
        "text_sha256": "3c2bf5b943e05cec886e91ec4575ed45ffc24810be7e38b2485d9ca964763331"
      },
      {
        "audience_review_status": "needs_review",
        "chunk_id": "hpa_dementia_health_education_resource_manual_201610_rag_v3_v003_0023",
        "effective_risk_level": "medium",
        "observed_allowed_audiences": [
          "care_professional",
          "family_caregiver"
        ],
        "observed_allowed_purposes": [
          "general_information",
          "health_education",
          "resource_navigation",
          "source_lookup"
        ],
        "owner_disposition": "CONDITIONALLY_RELEASABLE_AFTER_AUDIENCE_REVIEW",
        "prior_chunk_id": "hpa_dementia_health_education_resource_manual_201610_rag_v2_v002_0023",
        "required_next_gate": "PER_CHUNK_AUDIENCE_AND_PURPOSE_VERIFICATION",
        "runtime_retrieval_active": false,
        "source_id": "hpa_dementia_health_education_resource_manual_201610",
        "stop_normal_rag_preserved": true,
        "text_sha256": "6553e321243f72c1f387fc975fb4087860b8fb8e77d9f846ba68d0cab2ef9db1"
      },
      {
        "audience_review_status": "needs_review",
        "chunk_id": "hpa_dementia_health_education_resource_manual_201610_rag_v3_v003_0024",
        "effective_risk_level": "medium",
        "observed_allowed_audiences": [
          "care_professional",
          "family_caregiver"
        ],
        "observed_allowed_purposes": [
          "general_information",
          "health_education",
          "resource_navigation",
          "source_lookup"
        ],
        "owner_disposition": "CONDITIONALLY_RELEASABLE_AFTER_AUDIENCE_REVIEW",
        "prior_chunk_id": "hpa_dementia_health_education_resource_manual_201610_rag_v2_v002_0024",
        "required_next_gate": "PER_CHUNK_AUDIENCE_AND_PURPOSE_VERIFICATION",
        "runtime_retrieval_active": false,
        "source_id": "hpa_dementia_health_education_resource_manual_201610",
        "stop_normal_rag_preserved": true,
        "text_sha256": "7a606694f57d938c7caae34675ac93c04b1a6973ce8773cd71b0fa4d87c948b6"
      },
      {
        "audience_review_status": "needs_review",
        "chunk_id": "hpa_dementia_health_education_resource_manual_201610_rag_v3_v003_0025",
        "effective_risk_level": "medium",
        "observed_allowed_audiences": [
          "care_professional",
          "family_caregiver"
        ],
        "observed_allowed_purposes": [
          "general_information",
          "health_education",
          "resource_navigation",
          "source_lookup"
        ],
        "owner_disposition": "CONDITIONALLY_RELEASABLE_AFTER_AUDIENCE_REVIEW",
        "prior_chunk_id": "hpa_dementia_health_education_resource_manual_201610_rag_v2_v002_0025",
        "required_next_gate": "PER_CHUNK_AUDIENCE_AND_PURPOSE_VERIFICATION",
        "runtime_retrieval_active": false,
        "source_id": "hpa_dementia_health_education_resource_manual_201610",
        "stop_normal_rag_preserved": true,
        "text_sha256": "3fae887004b5633dcd4da0b0d04a888c2d05b153d1fbc3ef901370bb15b0110f"
      },
      {
        "audience_review_status": "needs_review",
        "chunk_id": "hpa_dementia_health_education_resource_manual_201610_rag_v3_v003_0026",
        "effective_risk_level": "medium",
        "observed_allowed_audiences": [
          "care_professional",
          "family_caregiver"
        ],
        "observed_allowed_purposes": [
          "general_information",
          "health_education",
          "resource_navigation",
          "source_lookup"
        ],
        "owner_disposition": "CONDITIONALLY_RELEASABLE_AFTER_AUDIENCE_REVIEW",
        "prior_chunk_id": "hpa_dementia_health_education_resource_manual_201610_rag_v2_v002_0026",
        "required_next_gate": "PER_CHUNK_AUDIENCE_AND_PURPOSE_VERIFICATION",
        "runtime_retrieval_active": false,
        "source_id": "hpa_dementia_health_education_resource_manual_201610",
        "stop_normal_rag_preserved": true,
        "text_sha256": "09ff54aad8b72d6dc6ad911d4a87b11e2b131bac6dfe2f58e33aa0f35e67491c"
      },
      {
        "audience_review_status": "needs_review",
        "chunk_id": "hpa_dementia_health_education_resource_manual_201610_rag_v3_v003_0037",
        "effective_risk_level": "medium",
        "observed_allowed_audiences": [
          "care_professional",
          "family_caregiver"
        ],
        "observed_allowed_purposes": [
          "general_information",
          "health_education",
          "resource_navigation",
          "source_lookup"
        ],
        "owner_disposition": "CONDITIONALLY_RELEASABLE_AFTER_AUDIENCE_REVIEW",
        "prior_chunk_id": "hpa_dementia_health_education_resource_manual_201610_rag_v2_v002_0037",
        "required_next_gate": "PER_CHUNK_AUDIENCE_AND_PURPOSE_VERIFICATION",
        "runtime_retrieval_active": false,
        "source_id": "hpa_dementia_health_education_resource_manual_201610",
        "stop_normal_rag_preserved": true,
        "text_sha256": "3f866700f14e9ca15b53649ec31a57a1a944c9382bc4aec72b6308d684cbe3f2"
      },
      {
        "audience_review_status": "needs_review",
        "chunk_id": "hpa_dementia_health_education_resource_manual_201610_rag_v3_v003_0038",
        "effective_risk_level": "medium",
        "observed_allowed_audiences": [
          "care_professional",
          "family_caregiver"
        ],
        "observed_allowed_purposes": [
          "general_information",
          "health_education",
          "resource_navigation",
          "source_lookup"
        ],
        "owner_disposition": "CONDITIONALLY_RELEASABLE_AFTER_AUDIENCE_REVIEW",
        "prior_chunk_id": "hpa_dementia_health_education_resource_manual_201610_rag_v2_v002_0038",
        "required_next_gate": "PER_CHUNK_AUDIENCE_AND_PURPOSE_VERIFICATION",
        "runtime_retrieval_active": false,